create extension diskquota;
select pg_sleep(1);
 pg_sleep 
----------
 
(1 row)

\! pg_ctl -D /tmp/pg_diskquota_test/data reload
server signaled
\! cp data/clarge.txt /tmp/clarge.txt
\! cp data/clarge.txt /tmp/csmall.txt
select pg_sleep(5);
 pg_sleep 
----------
 
(1 row)

-- Test schema quota 
create schema s1;
select diskquota.set_schema_quota_limit('s1', '1 MB');
 set_schema_quota_limit 
------------------------
 
(1 row)

set search_path to s1;
create table a(i int);
insert into a select generate_series(1,100);
-- expect insert fail
insert into a select generate_series(1,100000000);
ERROR:  schema's disk space quota exceeded with name:s1
-- expect insert fail
insert into a select generate_series(1,100);
ERROR:  schema's disk space quota exceeded with name:s1
create table a2(i int);
-- expect insert fail
insert into a2 select generate_series(1,100);
ERROR:  schema's disk space quota exceeded with name:s1
reset search_path;
-- Test role quota
CREATE role u1 NOLOGIN;
CREATE TABLE b (t text);
ALTER TABLE b OWNER TO u1;
select diskquota.set_role_quota_limit('u1', '1 MB');
 set_role_quota_limit 
----------------------
 
(1 row)

insert into b select generate_series(1,100);
-- expect insert fail
insert into b select generate_series(1,100000000);
ERROR:  role's disk space quota exceeded with name:u1
-- expect insert fail
insert into b select generate_series(1,100);
ERROR:  role's disk space quota exceeded with name:u1
-- Test alter table set schema
create schema s2;
set search_path to s1;
alter table a set schema s2;
select pg_sleep(3);
 pg_sleep 
----------
 
(1 row)

-- expect insert succeed
insert into a2 select generate_series(1,20000);
reset search_path;
-- Test alter table add column and truncate
set search_path to s1;
select pg_sleep(3);
 pg_sleep 
----------
 
(1 row)

insert into a2 select generate_series(1,10);
ALTER TABLE a2 ADD COLUMN j varchar(30);
update a2 set j = 'add value for column j';
select pg_sleep(3);
 pg_sleep 
----------
 
(1 row)

-- expect insert failed after add column
insert into a2 select generate_series(1,10);
ERROR:  schema's disk space quota exceeded with name:s1
truncate a2;
select pg_sleep(3);
 pg_sleep 
----------
 
(1 row)

create table a3(i int);
insert into a3 select generate_series(1,30000);
select pg_sleep(3);
 pg_sleep 
----------
 
(1 row)

-- expect alter table statement failed
ALTER TABLE a3 ADD COLUMN j int default 3;
ERROR:  schema's disk space quota exceeded with name:s1
reset search_path;
-- Test copy
create schema s3;
select diskquota.set_schema_quota_limit('s3', '1 MB');
 set_schema_quota_limit 
------------------------
 
(1 row)

set search_path to s3;
create table c (i int);
copy c from '/tmp/csmall.txt';
copy c from '/tmp/clarge.txt';
select pg_sleep(3);
 pg_sleep 
----------
 
(1 row)

-- expect copy fail
copy c from '/tmp/csmall.txt';
ERROR:  schema's disk space quota exceeded with name:s3
reset search_path;
-- Test Update
create schema s4;
select diskquota.set_schema_quota_limit('s4', '1 MB');
 set_schema_quota_limit 
------------------------
 
(1 row)

set search_path to s4;
create table a(i int);
insert into a select generate_series(1,30000);
select pg_sleep(3);
 pg_sleep 
----------
 
(1 row)

-- expect update fail.
update a set i = 100;
ERROR:  schema's disk space quota exceeded with name:s4
reset search_path;
-- Test toast
create schema s5;
select diskquota.set_schema_quota_limit('s5', '1 MB');
 set_schema_quota_limit 
------------------------
 
(1 row)

set search_path to s5;
CREATE TABLE a5 (message text);
INSERT INTO a5
SELECT (SELECT 
        string_agg(chr(floor(random() * 26)::int + 65), '')
        FROM generate_series(1,10000)) 
FROM generate_series(1,10);
-- expect insert toast fail
INSERT INTO a5
SELECT (SELECT 
        string_agg(chr(floor(random() * 26)::int + 65), '')
        FROM generate_series(1,100000)) 
FROM generate_series(1,1000);
ERROR:  schema's disk space quota exceeded with name:s5
reset search_path;
-- Test vacuum full
create schema s6;
select diskquota.set_schema_quota_limit('s6', '1 MB');
 set_schema_quota_limit 
------------------------
 
(1 row)

set search_path to s6;
create table a6 (i int);
insert into a6 select generate_series(1,30000);
select pg_sleep(3);
 pg_sleep 
----------
 
(1 row)

-- expect insert fail
insert into a6 select generate_series(1,30);
ERROR:  schema's disk space quota exceeded with name:s6
delete from a6 where i > 100;
vacuum full a6;
select pg_sleep(3);
 pg_sleep 
----------
 
(1 row)

-- expect insert succeed
insert into a6 select generate_series(1,30);
reset search_path;
-- Test truncate
create schema s7;
select diskquota.set_schema_quota_limit('s7', '1 MB');
 set_schema_quota_limit 
------------------------
 
(1 row)

set search_path to s7;
create table a7 (i int);
insert into a7 select generate_series(1,30000);
select pg_sleep(3);
 pg_sleep 
----------
 
(1 row)

-- expect insert fail
insert into a7 select generate_series(1,30);
ERROR:  schema's disk space quota exceeded with name:s7
truncate table a7;
select pg_sleep(3);
 pg_sleep 
----------
 
(1 row)

-- expect insert succeed
insert into a7 select generate_series(1,30);
reset search_path;
-- Test SPI
drop extension diskquota;
